{
  "version": 1,
  "thresholds": {
    "limited": 20,
    "high": 45
  },
  "questions": [
    {
      "id": "runtime_ai",
      "level": "intake",
      "factor": "scope",
      "text_en": "Does the solution use AI when it runs?",
      "text_ar": "هل يستخدم الحل الذكاء الاصطناعي أثناء تشغيله؟",
      "help_en": "Choose No if AI was only used to build it (for example an AI coding assistant) and the running product has no AI model or AI service inside.",
      "help_ar": "اختر «لا» إذا استُخدم الذكاء الاصطناعي في بنائه فقط (مثل مساعد برمجة ذكي)، ولا يتضمن المنتج أثناء تشغيله أي نموذج أو خدمة ذكاء اصطناعي.",
      "b2b_en": "Answer \"No\" only when no AI model or AI service runs in production, for example when AI coding tools were used just to build it. Such a solution is out of scope for AI risk tiers. If a hosted model is called anywhere at run time, answer \"Yes\".",
      "b2b_ar": "أجب بـ «لا» فقط إذا لم يعمل أي نموذج أو خدمة ذكاء اصطناعي في بيئة التشغيل، كأن تكون أدوات البرمجة الذكية قد استُخدمت في بنائه فقط؛ فيكون الحل حينها خارج نطاق مستويات مخاطر الذكاء الاصطناعي. وإذا استُدعي نموذج مستضاف في أي مرحلة أثناء التشغيل، فأجب بـ «نعم».",
      "options": [
        {
          "id": "yes",
          "points": 0,
          "en": "Yes: it uses an AI model or AI service when it runs",
          "ar": "نعم: يستخدم نموذجاً أو خدمة ذكاء اصطناعي أثناء التشغيل"
        },
        {
          "id": "no",
          "points": 0,
          "en": "No: AI was only used to build it, or not at all",
          "ar": "لا: استُخدم الذكاء الاصطناعي في بنائه فقط، أو لم يُستخدم إطلاقاً"
        }
      ]
    },
    {
      "id": "impact",
      "level": "quick",
      "factor": "impact",
      "text_en": "What does the AI's output influence?",
      "text_ar": "على ماذا تؤثر مخرجات نظام الذكاء الاصطناعي؟",
      "help_en": "Think about the most serious thing the output can lead to, not the usual case.",
      "help_ar": "فكّر في أخطر ما قد تؤدي إليه المخرجات، لا في الحالة المعتادة.",
      "b2b_en": "For a commercial or B2B tool, use \"High-stakes decisions or positions about other companies\" for claims, contract positions or credit decisions about other firms. Choose \"Information given to the public or customers\" for ordinary client deliverables such as reports or drafts, and \"Internal productivity only\" for tools used only by your own staff. If no person approves each of those decisions, the rule T-AUTONOMOUS-B2B-DECISIONS makes the tier High. Keep \"Decisions about people's rights, benefits, access to services or money\" for outputs that decide about a natural person.",
      "b2b_ar": "في الأدوات التجارية أو بين الشركات، استخدم خيار «قرارات أو مواقف عالية الأثر تخص شركات أخرى» للمطالبات أو المواقف التعاقدية أو القرارات الائتمانية بشأن شركات أخرى. اختر «معلومات تُقدَّم للجمهور أو المتعاملين» للمخرجات الاعتيادية المقدَّمة للعملاء مثل التقارير أو المسودات، واختر «الإنتاجية الداخلية فقط» للأدوات التي يستخدمها موظفوك فقط. وإذا لم يوافق شخص على كل قرار من هذه القرارات، فإن القاعدة T-AUTONOMOUS-B2B-DECISIONS تجعل المستوى مرتفعاً. واحتفظ بخيار «قرارات تمس حقوق الأفراد أو مستحقاتهم أو وصولهم إلى الخدمات أو أموالهم» للمخرجات التي تقرر بشأن شخص طبيعي.",
      "options": [
        {
          "id": "internal",
          "points": 0,
          "en": "Internal productivity only (drafts, summaries, search)",
          "ar": "الإنتاجية الداخلية فقط (مسودات، ملخصات، بحث)"
        },
        {
          "id": "public-info",
          "points": 5,
          "en": "Information given to the public or customers",
          "ar": "معلومات تُقدَّم للجمهور أو المتعاملين"
        },
        {
          "id": "recommend-individuals",
          "points": 15,
          "en": "Recommendations to staff about specific people",
          "ar": "توصيات للموظفين بشأن أشخاص بعينهم"
        },
        {
          "id": "decide-individuals",
          "points": 25,
          "en": "Decisions about people's rights, benefits, access to services or money",
          "ar": "قرارات تمس حقوق الأفراد أو مستحقاتهم أو وصولهم إلى الخدمات أو أموالهم"
        },
        {
          "id": "decide-organisations",
          "points": 20,
          "en": "High-stakes decisions or positions about other companies (claims, contract positions, commercial or credit decisions on firms)",
          "ar": "قرارات أو مواقف عالية الأثر تخص شركات أخرى (المطالبات، والمواقف التعاقدية، والقرارات التجارية أو الائتمانية بشأن المنشآت)"
        },
        {
          "id": "prohibited",
          "points": 0,
          "en": "Social scoring, manipulation, or real-time biometric surveillance of the public",
          "ar": "التصنيف الاجتماعي للأفراد، أو التلاعب بالسلوك، أو المراقبة البيومترية الفورية للجمهور"
        }
      ]
    },
    {
      "id": "data",
      "level": "quick",
      "factor": "data",
      "text_en": "What data does it use?",
      "text_ar": "ما البيانات التي يستخدمها؟",
      "help_en": "Sensitive data includes health, biometric, financial, criminal-record, religious and children's data.",
      "help_ar": "تشمل البيانات الحساسة البيانات الصحية والبيومترية والمالية والسوابق الجنائية والمعتقد الديني وبيانات الأطفال.",
      "b2b_en": "Contracts, correspondence and site records almost always include names, emails, signatures or phone numbers, so choose \"Personal data\" rather than \"Internal business data, no personal data\". Reserve \"Sensitive personal data\" for health, biometric, religious, criminal-record or financial-account details. Minimisation is a real lever: redacting personal data the task does not need (CTL-DAT-03) often moves a tool from High to Limited. Answer \"Internal business data, no personal data\" only once redaction is actually in place.",
      "b2b_ar": "تتضمن العقود والمراسلات وسجلات المواقع غالباً أسماءً أو بريداً إلكترونياً أو توقيعات أو أرقام هواتف، لذا اختر «بيانات شخصية» بدلاً من «بيانات عمل داخلية دون بيانات شخصية». اقتصر على خيار «بيانات شخصية حساسة» للبيانات الصحية أو البيومترية أو الدينية أو السوابق الجنائية أو البيانات المالية الحساسة. وتقليل البيانات وسيلة فعلية للتأثير: فحجب البيانات الشخصية التي لا تحتاج إليها المهمة (CTL-DAT-03) كثيراً ما ينقل الأداة من مستوى مرتفع إلى محدود. ولا تُجب بـ «بيانات عمل داخلية دون بيانات شخصية» إلا بعد تطبيق الحجب فعلاً.",
      "options": [
        {
          "id": "none",
          "points": 0,
          "en": "No data about people, or public data only",
          "ar": "لا بيانات عن الأشخاص، أو بيانات عامة فقط"
        },
        {
          "id": "internal",
          "points": 3,
          "en": "Internal business data, no personal data",
          "ar": "بيانات عمل داخلية دون بيانات شخصية"
        },
        {
          "id": "personal",
          "points": 10,
          "en": "Personal data",
          "ar": "بيانات شخصية"
        },
        {
          "id": "sensitive",
          "points": 18,
          "en": "Sensitive personal data",
          "ar": "بيانات شخصية حساسة"
        }
      ]
    },
    {
      "id": "affected",
      "level": "quick",
      "factor": "affected",
      "text_en": "Who could be affected?",
      "text_ar": "من قد يتأثر؟",
      "help_en": "Choose the most exposed group.",
      "help_ar": "اختر الفئة الأكثر عرضة للتأثر.",
      "b2b_en": "Choose \"Employees only\" for an internal tool and \"Customers or the public\" for a client-facing product. There is no separate option for counterparty companies; note them in the use case summary instead.",
      "b2b_ar": "اختر «الموظفون فقط» للأداة الداخلية، و«المتعاملون أو الجمهور» للمنتج الموجَّه للعملاء. لا يوجد خيار مستقل للشركات الطرف المقابل؛ اذكرها بدلاً من ذلك في ملخص حالة الاستخدام.",
      "options": [
        {
          "id": "staff",
          "points": 3,
          "en": "Employees only",
          "ar": "الموظفون فقط"
        },
        {
          "id": "public",
          "points": 8,
          "en": "Customers or the public",
          "ar": "المتعاملون أو الجمهور"
        },
        {
          "id": "vulnerable",
          "points": 15,
          "en": "Vulnerable groups (children, elderly, people with disabilities)",
          "ar": "فئات أكثر عرضة للتأثر (الأطفال، كبار السن، أصحاب الهمم)"
        }
      ]
    },
    {
      "id": "ai_type",
      "level": "quick",
      "factor": "ai_type",
      "text_en": "What kind of AI is it?",
      "text_ar": "ما نوع الذكاء الاصطناعي المستخدم؟",
      "help_en": "Per the UAE national reference, a system is agentic only if it works towards a goal, uses external tools or systems, keeps its working state, and runs its own step-by-step loop. Chatbots that only answer questions and fixed-script automation are not agentic.",
      "help_ar": "وفق الدليل التعريفي الوطني، لا يُعدّ النظام مساعداً (وكيلياً) إلا إذا عمل نحو هدف، واستخدم أدوات أو أنظمة خارجية، واحتفظ بحالة التشغيل، ونفّذ خطواته بشكل تكراري ذاتي. أما روبوتات المحادثة التي تكتفي بالإجابة والأتمتة ذات الخطوات الثابتة فليست كذلك.",
      "b2b_en": "Multi-step tools that draft, extract or calculate but take no external action are \"Generative (writes text, images or answers)\". Move to \"Agentic (plans and takes actions)\" once the system itself sends messages, files documents or writes to a system of record, and re-score whenever an integration adds such an action.",
      "b2b_ar": "الأدوات متعددة الخطوات التي تُعِدّ مسودات أو تستخرج بيانات أو تُجري حسابات دون اتخاذ إجراء خارجي تُصنَّف «توليدي (يُنتج نصوصاً أو صوراً أو إجابات)». وتنتقل إلى «وكيلي (يخطط وينفّذ إجراءات)» بمجرد أن يرسل النظام رسائل أو يقدّم مستندات أو يكتب في نظام سجل من تلقاء نفسه، مع إعادة التقييم كلما أضاف أي تكامل جديد إجراءً من هذا النوع.",
      "options": [
        {
          "id": "predictive",
          "points": 5,
          "en": "Predictive (scores, classifies, forecasts)",
          "ar": "تنبؤي (يقيّم أو يصنّف أو يتوقع)"
        },
        {
          "id": "generative",
          "points": 5,
          "en": "Generative (writes text, images or answers)",
          "ar": "توليدي (يُنتج نصوصاً أو صوراً أو إجابات)"
        },